{
  "$schema": "http://json-schema.org/draft-07/schema#",
  "$id": "https://pmcram.app/schema/deck.schema.json",
  "title": "PM Cram flashcard (custom deck)",
  "description": "A standalone flashcard for content that is not a glossary term (e.g. formulas, mnemonics). Glossary terms do NOT need this — they render as flashcards automatically.",
  "type": "object",
  "required": ["deck", "front", "back"],
  "additionalProperties": false,
  "properties": {
    "id": { "type": "string", "description": "OPTIONAL. Derived from content by the app when omitted; set one only to pin a correctable identity (kebab-case).", "pattern": "^[a-z0-9][a-z0-9-]*$" },
    "schema": { "type": "string", "const": "card/v1" },
    "deck": { "type": "string", "description": "Deck name this card belongs to." },
    "domain": { "type": "string", "enum": ["People", "Process", "Business Environment"] },
    "topic": { "type": "string" },
    "difficulty": { "type": "string", "enum": ["easy", "medium", "hard"] },
    "front": { "type": "string", "description": "Prompt side." },
    "back": { "type": "string", "description": "Answer side. Blank lines separate paragraphs; lines starting with '- ' become bullets." },
    "formula": { "type": "string", "description": "OPTIONAL equation, shown prominently above the answer (e.g. 'CPI = EV / AC')." },
    "legend": {
      "type": "array",
      "description": "OPTIONAL variable key shown under the formula.",
      "items": {
        "type": "object",
        "required": ["symbol", "meaning"],
        "additionalProperties": false,
        "properties": {
          "symbol": { "type": "string" },
          "meaning": { "type": "string" }
        }
      }
    },
    "figure": {
      "type": "object",
      "description": "OPTIONAL explanatory diagram/graph (same model as guide figures).",
      "additionalProperties": false,
      "properties": {
        "svg": { "type": "string", "description": "Inline theme-aware <svg> markup (use currentColor for ink)." },
        "image": { "type": "string", "description": "Repo-relative path or absolute URL of a raster image." },
        "caption": { "type": "string" }
      }
    },
    "tip": { "type": "string", "description": "OPTIONAL accent exam-tip callout." },
    "related": { "type": "array", "items": { "type": "string" } },
    "source": { "type": "string" },
    "contributor": { "type": "string" }
  }
}
