[
  {
    "schema": "card/v1",
    "deck": "PMP Mindset",
    "topic": "Mindset",
    "front": "A team member is underperforming. First move?",
    "back": "Understand the cause and support them — coaching, training, or pairing with a mentor. Don't remove, replace, or report them first."
  },
  {
    "schema": "card/v1",
    "deck": "PMP Mindset",
    "topic": "Mindset",
    "front": "Two stakeholders are in conflict and it's stalling decisions. First move?",
    "back": "Bring them together and facilitate a direct, collaborative resolution. Escalate only if that genuinely fails."
  },
  {
    "schema": "card/v1",
    "deck": "PMP Mindset",
    "topic": "Risk",
    "front": "A new risk surfaces mid-execution. First move?",
    "back": "Analyse it and record it in the risk register, then plan a response. Don't jump straight to a fix or to escalation."
  },
  {
    "schema": "card/v1",
    "deck": "PMP Mindset",
    "topic": "Change",
    "front": "A stakeholder requests a scope change on a predictive project. First move?",
    "back": "Run it through integrated change control: assess the impact, seek approval, then update the baselines. Never implement it silently."
  },
  {
    "schema": "card/v1",
    "deck": "PMP Mindset",
    "topic": "Agile",
    "front": "The customer requests a change mid-iteration on an agile project. First move?",
    "back": "Welcome it — review with the team and Product Owner and add it to the backlog to prioritise. Protect the current iteration's focus."
  },
  {
    "schema": "card/v1",
    "deck": "PMP Mindset",
    "topic": "Mindset",
    "front": "Something has gone wrong. Should you escalate to the sponsor?",
    "back": "Escalate last. Do what a PM can do first — investigate, communicate, replan — and escalate only when it's beyond your authority."
  },
  {
    "schema": "card/v1",
    "deck": "PMP Mindset",
    "topic": "Mindset",
    "front": "You're unsure what's actually happening on the project. First move?",
    "back": "Assess before acting: gather facts, review the plan and logs, understand the impact, then decide."
  },
  {
    "schema": "card/v1",
    "deck": "PMP Mindset",
    "topic": "Mindset",
    "front": "An option says 'do nothing' or 'let the team handle it entirely'. Likely right?",
    "back": "Usually wrong. Stay engaged — facilitate, support, and keep ownership of the outcome."
  },
  {
    "schema": "card/v1",
    "deck": "PMP Mindset",
    "topic": "Mindset",
    "front": "The team is blocked by an impediment. Your job?",
    "back": "Remove the obstacle and provide resources. That's servant leadership — not directing every detail."
  },
  {
    "schema": "card/v1",
    "deck": "PMP Mindset",
    "topic": "Scope",
    "front": "Tempted to add a nice extra the customer didn't ask for?",
    "back": "Don't gold-plate. Deliver the agreed scope; any new scope goes through change control."
  },
  {
    "schema": "card/v1",
    "deck": "PMP Mindset",
    "topic": "Mindset",
    "front": "Two answers both seem reasonable. How do you choose?",
    "back": "Pick the more proactive, collaborative, value-focused option that keeps you responsible — after eliminating the extremes."
  },
  {
    "schema": "card/v1",
    "deck": "PMP Mindset",
    "topic": "Communication",
    "front": "Best way to resolve a conflict or clear up confusion?",
    "back": "Prefer direct, interactive communication — face-to-face or a call — over email."
  }
]
