[
  {
    "id": "evm-cpi",
    "schema": "card/v1",
    "deck": "EVM Formulas",
    "domain": "Process",
    "topic": "Cost / EVM",
    "difficulty": "hard",
    "front": "Cost Performance Index (CPI) — formula and interpretation",
    "back": "CPI = EV / AC. CPI > 1 means under budget (earning more value than you spend); CPI < 1 means over budget. CPI = 1.0 is exactly on budget.",
    "related": ["Schedule Performance Index", "Estimate at Completion", "Earned Value"],
    "source": "PMBOK Guide — Earned Value Management"
  },
  {
    "id": "evm-spi",
    "schema": "card/v1",
    "deck": "EVM Formulas",
    "domain": "Process",
    "topic": "Cost / EVM",
    "difficulty": "hard",
    "front": "Schedule Performance Index (SPI) — formula and interpretation",
    "back": "SPI = EV / PV. SPI > 1 means ahead of schedule; SPI < 1 means behind schedule. SPI = 1.0 is on schedule.",
    "related": ["Cost Performance Index", "Planned Value", "Earned Value"],
    "source": "PMBOK Guide — Earned Value Management"
  },
  {
    "id": "evm-eac-typical",
    "schema": "card/v1",
    "deck": "EVM Formulas",
    "domain": "Process",
    "topic": "Cost / EVM",
    "difficulty": "hard",
    "front": "Estimate at Completion (EAC) when current variances are typical",
    "back": "EAC = BAC / CPI. Use when current cost performance is expected to continue for the rest of the project.",
    "related": ["Budget at Completion", "Cost Performance Index", "Estimate to Complete"],
    "source": "PMBOK Guide — Earned Value Management"
  }
]
